NO_ORGAO,NO_CARGO,GR_MAT,COTA,Percentual.cota,X20.,diferença
AGENCIA BRASILEIRA DE INTELIGENCIA,NA,4,0,0,1,1
AGENCIA NACIONAL DE AVIACAO CIVIL,NA,8,0,0,2,2
AGENCIA NACIONAL DE MINERACAO,NA,10,1,0.1,2,1
AMAZONIA AZUL TECNOLOGIAS DE DEFESA SA,NA,110,13,0.12000000000000001,22,9
CENTRO FED.DE EDUC.TECNOL.MINAS GERAIS,NA,26,3,0.12000000000000001,5,2
CENTRO FED.EDUC.TECNOL.CELSO S. FONSECA,NA,80,11,0.14,16,5
COLEGIO PEDRO II,NA,19,1,0.05,4,3
COMANDO DA MARINHA,NA,1,0,0,0,0
COMPANHIA BRASILEIRA DE TRENS URBANOS,NA,2,0,0,0,0
COMPANHIA DESENV. DO VALE SAO FRANCISCO,NA,83,0,0,17,17
CONTROLADORIA-GERAL DA UNIAO,NA,37,5,0.14,7,2
DEPARTAMENTO DE POLICIA FEDERAL,NA,13,2,0.15000000000000002,3,1
DEPTO. DE POLICIA RODOVIARIA FEDERAL,NA,10,1,0.1,2,1
EMPRESA BRAS. DE SERVICOS HOSPITALARES,NA,2092,314,0.15000000000000002,418,104
EMPRESA DE PESQUISA ENERGETICA,NA,46,0,0,9,9
EMPRESA DE TRENS URBANOS DE PORTO ALEGRE,NA,2,0,0,0,0
FUND. UNIV FEDERAL DA GRANDE DOURADOS,NA,21,3,0.14,4,1
FUND. UNIVERSIDADE DE SAO JOAO DEL REI,NA,29,4,0.14,6,2
FUND. UNIVERSIDADE FEDERAL DE RONDONIA,NA,8,0,0,2,2
FUND.UNIV.FED.CIENC.SAUDE D PORTO ALEGRE,NA,2,0,0,0,0
FUND.UNIV.FED.DO VALE DO SAO FRANCISCO,NA,27,7,0.26,5,-2
FUNDACAO UNIV. FEDERAL DE OURO PRETO,NA,4,0,0,1,1
FUNDACAO UNIV. FEDERAL DE UBERLANDIA,NA,72,9,0.13,14,5
FUNDACAO UNIVERSIDADE DE BRASILIA,NA,90,13,0.14,18,5
FUNDACAO UNIVERSIDADE DO AMAZONAS,NA,118,11,0.09,24,13
FUNDACAO UNIVERSIDADE DO MARANHAO,NA,66,1,0.02,13,12
FUNDACAO UNIVERSIDADE FED. DO TOCANTINS,NA,44,6,0.14,9,3
FUNDACAO UNIVERSIDADE FEDERAL DE PELOTAS,NA,44,12,0.27,9,-3
FUNDACAO UNIVERSIDADE FEDERAL DE SERGIPE,NA,18,2,0.11,4,2
FUNDACAO UNIVERSIDADE FEDERAL DO ABC,NA,57,5,0.09,11,6
FUNDACAO UNIVERSIDADE FEDERAL DO PAMPA,NA,14,0,0,3,3
FUNDACAO UNVERSIDADE FEDERAL DO AMAPA,NA,30,1,0.03,6,5
GOVERNO DO DISTRITO FEDERAL,NA,257,50,0.19,51,1
HOSPITAL DE CLINICAS DE PORTO ALEGRE,NA,614,75,0.12000000000000001,123,48
INST. BR. MEIO AMB. REC. NAT. RENOVAVEIS,NA,119,2,0.02,24,22
INSTITUTO CHICO MENDES CONSERV.BIODIVER.,NA,7,0,0,1,1
INSTITUTO DO PATR.HIST.E ART. NACIONAL,NA,86,23,0.27,17,-6
INSTITUTO FED. DO NORTE DE MINAS GERAIS,NA,23,3,0.13,5,2
INSTITUTO FED.DO SUDESTE DE MINAS GERAIS,NA,9,1,0.11,2,1
INSTITUTO FEDERAL BAIANO,NA,4,1,0.25,1,0
INSTITUTO FEDERAL CATARINENSE,NA,31,0,0,6,6
INSTITUTO FEDERAL DA BAHIA,NA,194,7,0.04,39,32
INSTITUTO FEDERAL DA PARAIBA,NA,2,0,0,0,0
INSTITUTO FEDERAL DE ALAGOAS,NA,49,6,0.12000000000000001,10,4
INSTITUTO FEDERAL DE BRASILIA,NA,7,0,0,1,1
INSTITUTO FEDERAL DE GOIAS,NA,26,2,0.08,5,3
INSTITUTO FEDERAL DE MATO GROSSO,NA,28,3,0.11,6,3
INSTITUTO FEDERAL DE MATO GROSSO DO SUL,NA,33,6,0.18,7,1
INSTITUTO FEDERAL DE MINAS GERAIS,NA,35,4,0.11,7,3
INSTITUTO FEDERAL DE PERNAMBUCO,NA,5,0,0,1,1
INSTITUTO FEDERAL DE RONDONIA,NA,18,2,0.11,4,2
INSTITUTO FEDERAL DE SANTA CATARINA,NA,102,14,0.14,20,6
INSTITUTO FEDERAL DE SAO PAULO,NA,64,7,0.11,13,6
INSTITUTO FEDERAL DO AMAPA,NA,1,0,0,0,0
INSTITUTO FEDERAL DO AMAZONAS,NA,53,1,0.02,11,10
INSTITUTO FEDERAL DO CEARA,NA,54,10,0.19,11,1
INSTITUTO FEDERAL DO ESPIRITO SANTO,NA,69,5,0.07,14,9
INSTITUTO FEDERAL DO MARANHAO,NA,77,14,0.18,15,1
INSTITUTO FEDERAL DO PARA,NA,63,7,0.11,13,6
INSTITUTO FEDERAL DO PARANA,NA,74,14,0.19,15,1
INSTITUTO FEDERAL DO PIAUI,NA,28,0,0,6,6
INSTITUTO FEDERAL DO RIO DE JANEIRO,NA,23,4,0.17,5,1
INSTITUTO FEDERAL DO RIO GRANDE DO SUL,NA,42,8,0.19,8,0
INSTITUTO FEDERAL DO SERTAO PERNAMBUCANO,NA,6,1,0.17,1,0
INSTITUTO FEDERAL DO SUL DE MINAS GERAIS,NA,22,1,0.05,4,3
INSTITUTO FEDERAL DO TOCANTINS,NA,17,2,0.12000000000000001,3,1
INSTITUTO FEDERAL DO TRIANGULO MINEIRO,NA,1,0,0,0,0
INSTITUTO FEDERAL FARROUPILHA,NA,45,8,0.18,9,1
INSTITUTO FEDERAL FLUMINENSE,NA,19,0,0,4,4
INSTITUTO FEDERAL GOIANO,NA,29,6,0.21000000000000002,6,0
INSTITUTO FEDERAL SUL RIO-GRANDENSE,NA,39,3,0.08,8,5
INSTITUTO NACIONAL DE SEGURO SOCIAL,NA,281,34,0.12000000000000001,56,22
MIN DOS DIR HUM E DA CIDADANIA,NA,1,0,0,0,0
MINISTERIO DA AGRICULTURA E PECUARIA,NA,5,0,0,1,1
MINISTERIO DA DEFESA,NA,53,5,0.09,11,6
MINISTERIO DA FAZENDA,NA,634,81,0.13,127,46
MINISTERIO DA PESCA E AQUICULTURA,NA,1,0,0,0,0
MINISTERIO DA PREVIDENCIA SOCIAL,NA,1,0,0,0,0
MINISTERIO DAS RELACOES EXTERIORES,NA,51,10,0.2,10,0
MINISTERIO DE MINAS E ENERGIA,NA,20,5,0.25,4,-1
TELEBRAS - TELECOM. BRASILEIRAS S.A.,NA,11,2,0.18,2,0
UN. INT.INTERN. LUSOFONIA AFROBRASILEIRA,NA,14,0,0,3,3
UNI.FED.VALES DO JEQUITINHONHA E MUCURI,NA,6,0,0,1,1
UNIV. FEDERAL DE MATO GROSSO DO SUL,NA,60,4,0.07,12,8
UNIV. FEDERAL DO DELTA DO PARNAIBA,NA,69,11,0.16,14,3
UNIV. FEDERAL DO RECONCAVO DA BAHIA,NA,46,10,0.22,9,-1
UNIV. FEDERAL RURAL DO RIO DE JANEIRO,NA,18,1,0.06,4,3
UNIV.FED. DA INTEGRACAO LATINO-AMERICANA,NA,8,1,0.13,2,1
UNIVERS. TECNOLOGICA FEDERAL DO PARANA,NA,46,2,0.04,9,7
UNIVERSIDADE DO RIO DE JANEIRO,NA,14,0,0,3,3
UNIVERSIDADE FED. DO RIO GRANDE DO NORTE,NA,46,6,0.13,9,3
UNIVERSIDADE FED. DO RIO GRANDE DO SUL,NA,172,23,0.13,34,11
UNIVERSIDADE FED. RURAL DO SEMI-ARIDO,NA,21,0,0,4,4
UNIVERSIDADE FED. SUL SUDESTE DO PARA,NA,11,0,0,2,2
UNIVERSIDADE FED.DO TRIANGULO MINEIRO,NA,11,2,0.18,2,0
UNIVERSIDADE FEDERAL DA BAHIA,NA,107,0,0,21,21
UNIVERSIDADE FEDERAL DA FRONTEIRA SUL,NA,25,2,0.08,5,3
UNIVERSIDADE FEDERAL DA PARAIBA,NA,113,11,0.1,23,12
UNIVERSIDADE FEDERAL DE ALAGOAS,NA,78,5,0.06,16,11
UNIVERSIDADE FEDERAL DE ALFENAS,NA,13,0,0,3,3
UNIVERSIDADE FEDERAL DE CAMPINA GRANDE,NA,3,0,0,1,1
UNIVERSIDADE FEDERAL DE CATALAO,NA,77,11,0.14,15,4
UNIVERSIDADE FEDERAL DE GOIAS,NA,71,10,0.14,14,4
UNIVERSIDADE FEDERAL DE ITAJUBA,NA,16,1,0.06,3,2
UNIVERSIDADE FEDERAL DE JATAI,NA,60,9,0.15000000000000002,12,3
UNIVERSIDADE FEDERAL DE JUIZ DE FORA,NA,36,3,0.08,7,4
UNIVERSIDADE FEDERAL DE LAVRAS,NA,41,3,0.07,8,5
UNIVERSIDADE FEDERAL DE MATO GROSSO,NA,4,0,0,1,1
UNIVERSIDADE FEDERAL DE MINAS GERAIS,NA,135,15,0.11,27,12
UNIVERSIDADE FEDERAL DE PERNAMBUCO,NA,158,29,0.18,32,3
UNIVERSIDADE FEDERAL DE RONDONOPOLIS,NA,81,11,0.14,16,5
UNIVERSIDADE FEDERAL DE RORAIMA,NA,46,0,0,9,9
UNIVERSIDADE FEDERAL DE SANTA CATARINA,NA,138,12,0.09,28,16
UNIVERSIDADE FEDERAL DE SANTA MARIA,NA,57,9,0.16,11,2
UNIVERSIDADE FEDERAL DE SAO CARLOS,NA,41,4,0.1,8,4
UNIVERSIDADE FEDERAL DE SAO PAULO,NA,20,2,0.1,4,2
UNIVERSIDADE FEDERAL DE VICOSA,NA,48,4,0.08,10,6
UNIVERSIDADE FEDERAL DO ACRE,NA,55,5,0.09,11,6
UNIVERSIDADE FEDERAL DO CARIRI,NA,4,0,0,1,1
UNIVERSIDADE FEDERAL DO CEARA,NA,57,5,0.09,11,6
UNIVERSIDADE FEDERAL DO ESPIRITO SANTO,NA,62,11,0.18,12,1
UNIVERSIDADE FEDERAL DO OESTE DA BAHIA,NA,12,2,0.17,2,0
UNIVERSIDADE FEDERAL DO OESTE DO PARA,NA,17,1,0.06,3,2
UNIVERSIDADE FEDERAL DO PARA,NA,112,12,0.11,22,10
UNIVERSIDADE FEDERAL DO PARANA,NA,138,19,0.14,28,9
UNIVERSIDADE FEDERAL DO PIAUI,NA,85,2,0.02,17,15
UNIVERSIDADE FEDERAL DO RIO DE JANEIRO,NA,165,26,0.16,33,7
UNIVERSIDADE FEDERAL DO RIO GRANDE,NA,29,2,0.07,6,4
UNIVERSIDADE FEDERAL DO SUL DA BAHIA,NA,26,3,0.12000000000000001,5,2
UNIVERSIDADE FEDERAL FLUMINENSE,NA,129,11,0.09,26,15
UNIVERSIDADE FEDERAL NORTE DO TOCANTINS,NA,80,17,0.21000000000000002,16,-1
UNIVERSIDADE FEDERAL RURAL DA AMAZONIA,NA,15,0,0,3,3
UNIVERSIDADE FEDERAL RURAL DE PERNAMBUCO,NA,15,2,0.13,3,1
